<?xml version="1.0" encoding="UTF-8"?>

<crf:ui-configuration xmlns:xsi="http://www.w3.org/2001/XMLSchema-instance"
         xmlns:crf="http://mobile.sensis.com.au/web/crf/config"
         xsi:schemaLocation="http://mobile.sensis.com.au/web/crf/config crf-config.xsd">

    <config-path></config-path>
    <groups>
        <!-- Device specific groups. -->
        <group name="iphone-ipod-os2" expr="device.name =~ '.*iPhone.*' and device.userAgent =~ '.*OS 2_.*'" />
        <group name="iphone-ipod" expr="device.name =~ '.*iPhone.*'" />
        <group name="nokia7600" expr = "device.userAgent =~ '.*Nokia7600.*'" />        
        <group name="Apple-iPad" expr="device.name =~ '.*iPad.*'" />
	 	<group name="Samsung-GT-C5220" expr="device.name =~ '.*Samsung.*C5220.*'" />
	 	<group name="Samsung-SGH-A412" expr="device.name =~ '.*Samsung.*SGH.*A412.*'" />
	 	<group name="Samsung-SGH-F480" expr="device.name =~ '.*Samsung.*SGH.*F480.*'" />
	 	<group name="SAGEM-HomeManager" expr="device.name =~ '.*SAGEM-HomeManager.*'" />
		<group name="BlackBerry-9700" expr="device.name =~ '.*BlackBerry9700.*'" />
		<group name="HTC-Desire" expr="device.isA('HTC-A8183')" />
		<!--<group name="highend-maps" expr="device.isOneOf('HTC-A8183', 'SonyEricsson-X10')" />
		 <group name="HTC-Desire" expr="device.name =~ '.*HTC.*Desire.*A8183.*'" /> -->
		<group name="SonyEricsson-Z750i" expr="device.name =~ '.*SonyEricsson.*Z750i.*'" />

		<!-- Browser family groups. -->
		<group name="LG-Obigo" expr="device.userAgent =~ '.*LG.*Obigo.*'" />
	 	<group name="Nokia-Webkit" expr="device.userAgent =~ '.*Nokia.*AppleWebKit.*'" />        
        <group name="applewebkit" expr="device.userAgent =~ '.*AppleWebKit.*'" />
        <group name="webkit" expr="device.userAgent =~ '.*WebKit.*'" />
        <group name="Apple" expr="device.name =~ '.*Apple.*'" />
	 	<group name="Android" expr="device.userAgent =~ '.*Android.*'" />

        <!-- Image category groups. -->
        <group name="HD800" expr="device.imageCategory eq 'HD800'" />
        <group name="HD640" expr="device.imageCategory eq 'HD640'" />
        <group name="HD480" expr="device.imageCategory eq 'HD480'" />
        <group name="L" expr="device.imageCategory eq 'L'" />
        <group name="M" expr="device.imageCategory eq 'M'" />
        <group name="S" expr="device.imageCategory eq 'S'" />
        <group name="XS" expr="device.imageCategory eq 'XS'" />
        
        <group name="clickToCallSupported" expr="device.clickToCallSupported" />
        
        <!-- Test usage of the custom CRF inAllGroups function. -->
        <group name="clickToCallSupported-hd640" expr="inAllGroups(device, 'clickToCallSupported', 'HD640')" />
        
        <default-group name="default" />
    </groups>

</crf:ui-configuration>