<?xml version="1.0" encoding="UTF-8"?>

<crf:ui-configuration xmlns:xsi="http://www.w3.org/2001/XMLSchema-instance"
         xmlns:crf="http://mobile.sensis.com.au/web/crf/config"
         xsi:schemaLocation="http://mobile.sensis.com.au/web/crf/config crf-config.xsd">

    <config-path></config-path>
    <groups>
        <group name="iphone" expr="device.name =~ '.*iPhone.*'" />
        <group name="android-os" expr="device.isA('Android-OS') or device.isA('Android-Emulator')" />
        <group name="ipad" expr = "device.isA('Apple-iPad')" />
        <group name="applewebkit" expr="device.userAgent =~ '.*AppleWebKit.*'" />
        <group name="L" expr="device.imageCategory eq 'L'" />
        <group name="M" expr="device.imageCategory eq 'M'" />
        
        <default-group name="default" />
    </groups>

</crf:ui-configuration>