<?xml version="1.0" encoding="UTF-8"?>

<crf:ui-configuration xmlns:xsi="http://www.w3.org/2001/XMLSchema-instance"
         xmlns:crf="http://mobile.sensis.com.au/web/crf/config"
         xsi:schemaLocation="http://mobile.sensis.com.au/web/crf/config crf-config.xsd">

    <config-path>selenium/component/map</config-path>
    <groups>
        <!-- Device specific groups. -->
        <group name="android-os" expr="device.isA('Android-OS') or device.isA('Android-Emulator')" />
        <group name="iphone-ipod" expr="device.name =~ '.*iPhone.*'" />
        
        <!-- 
          - NOTE: completely fabricated group name to ensure that resources picked up from this group
          - were not resolved by the default crf-config.xml. 
          -->
        <!-- Test usage of the custom CRF inAnyGroup function. -->
        <group name="mapComponent-advanced" expr="inAnyGroup('android-os', 'iphone-ipod')" />
        
        <!-- Browser family groups. -->        
        <group name="applewebkit" expr="device.userAgent =~ '.*AppleWebKit.*'" />
        <group name="webkit" expr="device.userAgent =~ '.*WebKit.*'" />
        
        <default-group name="default" />
    </groups>

</crf:ui-configuration>