<?xml version="1.0" encoding="UTF-8"?>

<crf:ui-configuration xmlns:xsi="http://www.w3.org/2001/XMLSchema-instance"
         xmlns:crf="http://mobile.sensis.com.au/web/crf/config"
         xsi:schemaLocation="http://mobile.sensis.com.au/web/crf/config crf-config.xsd">

    <config-path>global/devices</config-path>
    <groups>

        <!-- Apple devices. -->
        <group name="iphone-ipod-os2-x" expr="(device.isA('Apple-iPhone') or device.isA('Apple-iPod-Touch')) and device.userAgent =~ '.*OS 2_.*'" />
        <group name="iphone-ipod-os3-x" expr="(device.isA('Apple-iPhone') or device.isA('Apple-iPod-Touch')) and device.userAgent =~ '.*OS 3_.*'" />
        <group name="iphone-ipod-os4-x" expr="(device.isA('Apple-iPhone') or device.isA('Apple-iPod-Touch')) and device.userAgent =~ '.*OS 4_.*'" />
        
        <group name="iphone-ipod-upto-os3-x" expr="inAnyGroup('iphone-ipod-os-2-x', 'iphone-ipod-os-3-x')" />
        <group name="iphone-ipod-upto-os4-x" expr="inAnyGroup('iphone-ipod-upto-os3-x', 'iphone-ipod-os-4-x')" />
        <group name="iphone-ipod" expr="device.isA('Apple-iPhone') or device.isA('Apple-iPod-Touch')" />
        
        <group name="ipad-os3-x" expr="device.isA('Apple-iPad') and device.userAgent =~ '.*OS 3_.*'" />
        <group name="ipad-os4-x" expr="device.isA('Apple-iPad') and device.userAgent =~ '.*OS 4_.*'" />        
        
        <group name="ipad-upto-os4-x" expr="inAnyGroup('ipad-os3-x', 'ipad-os4-x')" />
        <group name="ipad" expr="device.isA('Apple-iPad')" />
        
        <group name="apple" expr="device.isA('Apple')" />
        
        <!-- Android devices. -->
        <group name="sex10" expr="device.isA('SonyEricsson-X10')" />
        <group name="sex10mini" expr="device.isA('SE-X10-mini')" />
        <group name="htc-desire" expr="device.isA('HTC-Desire') or device.isA('HTC-A8183')" />

        <group name="android-os1-x" expr="device.isA('Android-OS') and device.userAgent =~ '.*Android 1\..*'" />        
        <group name="android-os2-x" expr="device.isA('Android-OS') and device.userAgent =~ '.*Android 2\..*'" />
        
        <group name="android-upto-os2-x" expr="inAnyGroup('android-os1-x', 'android-os2-x')" />
        
        <group name="android-os" expr="device.isA('Android-OS')" />
        
        <!-- Windows 7. -->
        <group name="windows7" expr="device.isA('SP-WindowsMobile-7')" />
        
        <!-- Blackberry -->
        <group name="blackberry" expr="device.isA('RIM-Blackberry')" />
        
        <!-- thub. -->
        <group name="thub" expr="device.isA('SAGEM-HomeManager')" />
        
        <!-- Nokia devices. -->
        <group name="nokiaS60DP3" expr="device.isA('Nokia-Series60-DP3_0')" />
        <group name="nokiaS60DP5" expr="device.isA('Nokia-Series60-DP5_0')" />
        
        <!-- Samsung devices. -->
        <group name="samsungC5220" expr="device.isA('Samsung-GT-C5220') " />        
        
        <!-- PC. -->
        <group name="mozilla" expr="device.isA('PC-Win32-Mozilla') or
                                    device.isA('PC-MacOS-Mozilla') or
                                    device.isA('PC-UNIX-Mozilla')"/>
                                    
        <group name="opera" expr="device.isA('PC-Win32-Opera') or
                                  device.isA('PC-MacOS-Opera') or
                                  device.isA('PC-UNIX-Opera')"/>
        
        <default-group name="default" />
    </groups>

</crf:ui-configuration>